title,update_count2
,0
Nieuwshub voor Raging Ball,1
Nieuwshub voor Six F and Six 0,1
Nieuwshub voor Beyond DAWN,1
Nieuwshub voor Sprite Sequence Chapter 1,1
Nieuwshub voor Ghostory,28
Nieuwshub voor Sheep Game,1
Nieuwshub voor Dream Catcher: Prologue,1
Nieuwshub voor Last Soul - Prologue,11
Nieuwshub voor SUPERゆきおんなちゃん,6
Nieuwshub voor Polygon Hero,5
Nieuwshub voor Let's Go Nuts!,12
Nieuwshub voor Spirit Arena,17
Nieuwshub voor Universe Balancing Bureau,3
Nieuwshub voor Sam & Max 304: Beyond the Alley of the Dolls,1
Nieuwshub voor Sword Game,5
Nieuwshub voor GI Racing 2.0,9
Nieuwshub voor Buildodge,9
Nieuwshub voor Bamerang: Warm-Up Duel,1
Nieuwshub voor CD-RUN,31
Nieuwshub voor Betrayer: Curse of the Spine - Prologue,1
Nieuwshub voor 藏梦：序曲,1
Nieuwshub voor The Benza RPG,9
Nieuwshub voor Zenko: A Fox's Tale,4
Nieuwshub voor Crome: Before Purgatory,3
Nieuwshub voor Tombo Survivor,1
Nieuwshub voor Deep Night Detective - Chapter One,3
Nieuwshub voor DERE EXE: Rebirth of Horror,1
Nieuwshub voor Spark and Sparkle,10
Nieuwshub voor Beyond,1
Nieuwshub voor Stories of Mara,3
Nieuwshub voor Endless Furry Ping-Pong,3
Nieuwshub voor Tin Hearts,8
Nieuwshub voor Happy Funtime Labs,1
Nieuwshub voor Ultreïa: Prologue,1
Nieuwshub voor ImageStriker,1
"Nieuwshub voor Drumpf: Rise Up, Libertonia!",13
Nieuwshub voor Bow to Blood: Last Captain Standing,1
Nieuwshub voor Super Perspective,8
Nieuwshub voor These Nights Alone,1
Nieuwshub voor Ascension: Transition and Silver,3
Nieuwshub voor CONNECTED!,1
Nieuwshub voor The Last Stand,1
Nieuwshub voor Mount Serenity: Guardian of the Spirits,1
Nieuwshub voor Secrets Of Soil,1
Nieuwshub voor Leave The Red,6
Nieuwshub voor MOENTO - Modular Environment Toolkit,10
Nieuwshub voor Swarm the City: Prologue,8
Nieuwshub voor Westwood Shadows: Prologue,11
Nieuwshub voor Rabby in the Land of Sweets,1
Nieuwshub voor CYBERDAD,1
Nieuwshub voor 涅槃之路,1
Nieuwshub voor Mandew vs the Colorless Curse,3
Nieuwshub voor PolyCube,23
Nieuwshub voor DeathTolls Experience,3
Nieuwshub voor Gundy,6
Nieuwshub voor Hold Your Ground,7
Nieuwshub voor Aeon Drive: Tournament,3
Nieuwshub voor Grand Theft Auto III,1
Nieuwshub voor Clodhoppers,7
Nieuwshub voor Mainframe Defenders: Meltdown - Prologue,1
Nieuwshub voor Bulk Dominoes VR: Kinetic Rush,1
Nieuwshub voor Journey to the Centre of the Cell,1
Nieuwshub voor Cyberplug,3
Nieuwshub voor Kamu's Offering,1
Nieuwshub voor Fork Knights,4
Nieuwshub voor Arausio,3
Nieuwshub voor グランドインテンション・アジャストメント,12
Nieuwshub voor First Person Shooter Kit Showcase,1
Nieuwshub voor Oona the Druid's Path,6
Nieuwshub voor Sam & Max 305: The City That Dares Not Sleep,1
Nieuwshub voor Dash Lamb,1
Nieuwshub voor Ynglet: Prologue,1
Nieuwshub voor Phantom Jump,5
Nieuwshub voor Cubrick,3
Nieuwshub voor Jetscout: Boot Camp,1
Nieuwshub voor Blood Brothers,1
Nieuwshub voor Wacktory,1
Nieuwshub voor Wonhon: Prologue,1
Nieuwshub voor Sam & Max 203: Night of the Raving Dead,1
Nieuwshub voor Team Racing League,34
Nieuwshub voor Digital Zoo Gallery,18
Nieuwshub voor Gordon Adventure,3
Nieuwshub voor Moi Mei 2,3
Nieuwshub voor The Land of Crows,7
Nieuwshub voor Taekwondo Grand Prix,18
Nieuwshub voor Ransack Raccoon,1
Nieuwshub voor Sam & Max 303: They Stole Max's Brain!,1
Nieuwshub voor Stan Lee's Verticus,1
Nieuwshub voor Drekirokr - Dusk of the Dragon,3
Nieuwshub voor Meow Pow,11
Nieuwshub voor Witchinour,48
Nieuwshub voor Pummel Paladins,1
Nieuwshub voor Nemo Dungeon,20
Nieuwshub voor Metagalactic Blitz,47
Nieuwshub voor Nine Witches: Family Disruption - Prologue,1
Nieuwshub voor Dark Descent: The Blue Rose,1
Nieuwshub voor Beyond,1
Nieuwshub voor Stories of Mara,3
Nieuwshub voor Endless Furry Ping-Pong,3
Nieuwshub voor Tin Hearts,8
Nieuwshub voor Happy Funtime Labs,1
Nieuwshub voor Ultreïa: Prologue,1
Nieuwshub voor ImageStriker,1
"Nieuwshub voor Drumpf: Rise Up, Libertonia!",13
Nieuwshub voor Bow to Blood: Last Captain Standing,1
Nieuwshub voor Super Perspective,8
Nieuwshub voor These Nights Alone,1
Nieuwshub voor Mainframe Defenders: Meltdown - Prologue,1
Nieuwshub voor Kromaia,11
Nieuwshub voor Bulk Dominoes VR: Kinetic Rush,1
Nieuwshub voor Journey to the Centre of the Cell,1
Nieuwshub voor Tomorrow,1
Nieuwshub voor Soulscape,1
Nieuwshub voor Play With Gilbert - A Small Tail,4
Nieuwshub voor A Field of Flowers and Stars,1
Nieuwshub voor Monolithic,3
Nieuwshub voor アトペス,3
Nieuwshub voor Shut your teeth,1
Nieuwshub voor Jack Axe: The Trial,1
Nieuwshub voor fishy,1
Nieuwshub voor Oakrot - it's literally a book,4
Nieuwshub voor A Strange City,4
Nieuwshub voor Synthbiotic Dungeon,9
Nieuwshub voor Yupitergrad 🚀: Sneaki Peaki (Virtual Reality Adventure),5
Nieuwshub voor Sea of Roses,1
Nieuwshub voor Descent: Legends of the Dark,9
Nieuwshub voor Appetite for Detestation,1
Nieuwshub voor Solaris,1
Nieuwshub voor Project Grove: Prologue,6
Nieuwshub voor Red Embrace: Mezzanine,3
Nieuwshub voor Nemezis: Mysterious Journey III Prologue,4
Nieuwshub voor Digital Expo Center,1
Nieuwshub voor GLIM,1
Nieuwshub voor Friend ReQuest - A Playable Teaser,9
Nieuwshub voor snowboarding,3
Nieuwshub voor Star Vortex,4
Nieuwshub voor Holt,3
Nieuwshub voor Kellogg's Gut Bacteria Reef,1
Nieuwshub voor Nightmares to be,4
Nieuwshub voor Peblito: Rock and Roll,1
Nieuwshub voor Rising Spire: Prelude,7
Nieuwshub voor The Shape of Time,1
Nieuwshub voor Pizza Apocalypse,3
Nieuwshub voor Marble Pop Paradise,1
Nieuwshub voor Swarm the City: Prologue,8
Nieuwshub voor Westwood Shadows: Prologue,11
Nieuwshub voor Ynglet: Prologue,1
Nieuwshub voor Zenko: A Fox's Tale,4
Nieuwshub voor Ghostory,28
Nieuwshub voor Sheep Game,1
Nieuwshub voor Dream Catcher: Prologue,1
Nieuwshub voor snowboarding,3
Nieuwshub voor Last Soul - Prologue,11
Nieuwshub voor SUPERゆきおんなちゃん,6
Nieuwshub voor Rabby in the Land of Sweets,1
Nieuwshub voor Polygon Hero,5
Nieuwshub voor Westwood Shadows: Prologue,11
Nieuwshub voor Let's Go Nuts!,12
Nieuwshub voor Spirit Arena,17
Nieuwshub voor Universe Balancing Bureau,3
Nieuwshub voor Sam & Max 304: Beyond the Alley of the Dolls,1
Nieuwshub voor Swarm the City: Prologue,8
Nieuwshub voor Buildodge,9
Nieuwshub voor Bamerang: Warm-Up Duel,1
Nieuwshub voor CD-RUN,31
Nieuwshub voor Betrayer: Curse of the Spine - Prologue,1
Nieuwshub voor Jack Axe: The Trial,1
Nieuwshub voor 藏梦：序曲,1
Nieuwshub voor The Benza RPG,9
Nieuwshub voor LongStory,15
Nieuwshub voor VR SHOOT AROUND - Realistic basketball simulator -,72
Nieuwshub voor Yandere School,3
Nieuwshub voor VR Ping Pong Pro,19
Nieuwshub voor Super Squad,73
Nieuwshub voor Royal Offense,19
Nieuwshub voor Omega Quintet,5
Nieuwshub voor Wheelchair Simulator,3
Nieuwshub voor Dungeon Brewmaster,11
Nieuwshub voor Doorways: Holy Mountains of Flesh,69
Nieuwshub voor Shoot Them,1
Nieuwshub voor Golf Pool VR,3
Nieuwshub voor Choice of the Vampire,3
Nieuwshub voor Planet B24,1
Nieuwshub voor Unmoor,3
Nieuwshub voor Starters Orders 7 Horse Racing,32
Nieuwshub voor War Of The Zombie,26
Nieuwshub voor ChessBase 15 Steam Edition,1
Nieuwshub voor Durak!,1
Nieuwshub voor Flockers™,29
Nieuwshub voor Died Of Fear,1
Nieuwshub voor UFO Online: Invasion,161
Nieuwshub voor The Magician's Workshop,1
Nieuwshub voor 圣三国英杰传,23
Nieuwshub voor Disney The Princess and the Frog,1
Nieuwshub voor Axis Football 2019,13
Nieuwshub voor Patchwork,3
Nieuwshub voor Axis Football 2019,13
Nieuwshub voor Patchwork,3
Nieuwshub voor Mist Hunter,30
Nieuwshub voor Spellweaver,50
Nieuwshub voor Bunker Punks,97
Nieuwshub voor Orbital Racer,14
Nieuwshub voor Disney Bolt,1
Nieuwshub voor The Seven Years War (1756-1763),78
Nieuwshub voor Street Fighter® IV,3
Nieuwshub voor Steampunk Tower 2,12
Nieuwshub voor Millennium 2 - Take Me Higher,20
Nieuwshub voor Parkan 2,3
Nieuwshub voor Mountain Taxi Driver,1
Nieuwshub voor Deadly Dozen,1
Nieuwshub voor Thirst VR,19
Nieuwshub voor Retrovirus,5
Nieuwshub voor Abandoned: Chestnut Lodge Asylum,1
Nieuwshub voor Gear Up,134
Nieuwshub voor Aeronautica Imperialis: Flight Command,12
Nieuwshub voor Aarklash: Legacy,13
Nieuwshub voor Chime Sharp,23
Nieuwshub voor Offroad Horizons: Arcade Rock Crawling,6
Nieuwshub voor Nautical Life,7
Nieuwshub voor Shtriga: Summer Camp,1
Nieuwshub voor Revolution Under Siege Gold,5
Nieuwshub voor Wayward Souls,62
Nieuwshub voor WHEEL TRAVEL,39
Nieuwshub voor Shaq Fu: A Legend Reborn,1
Nieuwshub voor RoboBall,5
Nieuwshub voor Jet Set Knights,57
Nieuwshub voor HERO DEFENSE,79
Nieuwshub voor Tennis World Tour,14
Nieuwshub voor Close Me,44
Nieuwshub voor Sportsfriends,1
Nieuwshub voor Ridge Racer™ Unbounded,1
Nieuwshub voor Tyrgard Archer VR,10
Nieuwshub voor Christmas Stories: Enchanted Express Collector's Edition,1
Nieuwshub voor City of Chains,19
Nieuwshub voor DEUS EX MACHINA 2,1
Nieuwshub voor Clutch,1
Nieuwshub voor Eschalon: Book III,5
Nieuwshub voor Disney's Chicken Little: Ace in Action,1
Nieuwshub voor Slab,10
Nieuwshub voor FM,3
Nieuwshub voor Last Floor,7
Nieuwshub voor Breakneck,3
Nieuwshub voor My Night Job,5
Nieuwshub voor 牧剑(Tale Of Swords),12
Nieuwshub voor DYING: Reborn,8
Nieuwshub voor Fat Prisoner Simulator 3,1
Nieuwshub voor BIT.TRIP VOID,1
Nieuwshub voor DYING: Reborn,8
Nieuwshub voor Fat Prisoner Simulator 3,1
Nieuwshub voor Witching Tower VR,30
Nieuwshub voor Disciples III - Renaissance Steam Special Edition,1
Nieuwshub voor Cladun Returns: This Is Sengoku!,16
Nieuwshub voor Nights of Azure,7
Nieuwshub voor Twin Peaks VR,1
Nieuwshub voor Horse Farm,1
Nieuwshub voor Heroes of Normandie,36
Nieuwshub voor Beautiful Masseuse / 美足按摩师,1
Nieuwshub voor Odyssey - The Story of Science,7
Nieuwshub voor Dead In Bermuda,34
Nieuwshub voor Undefeated,14
Nieuwshub voor Strategic Command Classic: WWII,10
Nieuwshub voor Bounce,3
Nieuwshub voor The Yolk Street,4
Nieuwshub voor Quantum Suicide,30
Nieuwshub voor Has-Been Heroes,12
Nieuwshub voor FULLCHOKE : Clay Shooting VR,5
Nieuwshub voor Sparkle 2 Evo,29
Nieuwshub voor Castles II: Siege & Conquest,1
Nieuwshub voor Another Sight - Definitive Edition,18
Nieuwshub voor Cally's Trials,9
Nieuwshub voor DinoScape,1
Nieuwshub voor VR Roller Coaster - Cave Depths,3
Nieuwshub voor Mugen Souls Z,3
Nieuwshub voor Ragnarok Chess,1
Nieuwshub voor Affairs of the Court: Choice of Romance,1
Nieuwshub voor Gunman Tales,21
Nieuwshub voor Spaceman Sparkles 2,14
Nieuwshub voor Event Horizon,23
Nieuwshub voor Battle Royale Trainer,47
Nieuwshub voor Midnight Mysteries: Salem Witch Trials,3
Nieuwshub voor VR Mini Bowling,17
Nieuwshub voor Under a Desert Sun,149
Nieuwshub voor Aquila Bird Flight Simulator,57
Nieuwshub voor Dark Parables: The Swan Princess and The Dire Tree Collector's Edition,8
Nieuwshub voor Drums Hero,20
Nieuwshub voor Legends of Aria,51
Nieuwshub voor 降妖神兵,17
Nieuwshub voor NOBUNAGA’S AMBITION: Haouden with Power Up Kit / 信長の野望・覇王伝 with パワーアップキット,3
Nieuwshub voor Alien Breed 3: Descent,1
Nieuwshub voor Mystery Expedition: Prisoners of Ice,1
Nieuwshub voor 九霄仙阙,15
Nieuwshub voor Shogun's Empire: Hex Commander,1
Nieuwshub voor Battle Bruise 2,1
Nieuwshub voor Girls' civilization,55
Nieuwshub voor RASPBERRY MASH,1
Nieuwshub voor Deep Dark Fight,8
Nieuwshub voor Enforcer: Police Crime Action,30
Nieuwshub voor The Barbarian and the Subterranean Caves,10
Nieuwshub voor DUO,12
Nieuwshub voor Monster Loves You!,8
Nieuwshub voor Blocks!: Richard III,10
Nieuwshub voor Superstar Dance Club,1
Nieuwshub voor Slap Village: Reality Slap,5
Nieuwshub voor The Detail,18
Nieuwshub voor 幻想三國誌5/Fantasia Sango 5,17
Nieuwshub voor Forgotten Places: Regained Castle,5
Nieuwshub voor Paper Dolls VR,18
Nieuwshub voor Nicole,7
Nieuwshub voor 浮世万千之前世今生,17
Nieuwshub voor DreadEye VR,39
Nieuwshub voor Speed Swing,9
Nieuwshub voor Shan Gui (山桂),33
Nieuwshub voor Planet Nomads,192
Nieuwshub voor IIN,6
Nieuwshub voor Battle of the Bulge,33
Nieuwshub voor Karos,30
Nieuwshub voor Rex Rocket,5
Nieuwshub voor Mr.King Luo!Don't be kidding,10
Nieuwshub voor SpaceShot,11
Nieuwshub voor Bombix,21
"Nieuwshub voor Rock, Paper, Scissors Simulator",1
Nieuwshub voor Record of Agarest War Mariage,7
Nieuwshub voor Street Power Football,3
Nieuwshub voor Minds of Nations,35
Nieuwshub voor Nira,58
Nieuwshub voor Edge of Reality,5
Nieuwshub voor Dr. Cares - Amy's Pet Clinic,1
Nieuwshub voor Micro Pico Racers,1
Nieuwshub voor Among School Girls,1
Nieuwshub voor Beat The Game,12
Nieuwshub voor PROZE: Enlightenment,48
Nieuwshub voor Mars Odyssey,5
Nieuwshub voor Runner3,3
Nieuwshub voor Firefight,13
Nieuwshub voor Handball Action Total,7
Nieuwshub voor Freefall Tournament,6
Nieuwshub voor Subterra,1
Nieuwshub voor Line of Sight,236
Nieuwshub voor Dungeons of Betrayal,31
Nieuwshub voor ACT IT OUT XL! A Game of Charades - Designed for Twitch,5
Nieuwshub voor Precursors,1
Nieuwshub voor Evasion,25
Nieuwshub voor RPG World - Action RPG Maker,83
Nieuwshub voor Celestial Crossing,14
Nieuwshub voor Loser Reborn,5
Nieuwshub voor Formula Truck 2013,16
Nieuwshub voor StuntMANIA Reloaded,5
Nieuwshub voor Little Dungeon Stories,5
Nieuwshub voor Machines At War 3,6
Nieuwshub voor PositronX,30
Nieuwshub voor The Dark Legions,3
Nieuwshub voor Fields of Battle,3
Nieuwshub voor Katana X,10
"Nieuwshub voor Tactics V: ""Obsidian Brigade""",15
Nieuwshub voor Mahjong Club,19
Nieuwshub voor Balance Roll,1
Nieuwshub voor Simple Story - Alex,29
Nieuwshub voor Fateline(命运线),4
Nieuwshub voor My Ex-Boyfriend the Space Tyrant,15
Nieuwshub voor Horse Riding Tales,1
Nieuwshub voor Dokkaebi Hentai Adventures,7
Nieuwshub voor KickBeat Steam Edition,1
Nieuwshub voor Zombeer,8
Nieuwshub voor Warfare 1944,25
Nieuwshub voor Cafe Crush,15
Nieuwshub voor uFactory,59
Nieuwshub voor Super Tennis Blast,7
Nieuwshub voor Demolition Inc.,1
Nieuwshub voor Rabbit Story,1
Nieuwshub voor 鬼畜大冒险 Gui Chu Da Mao Xian,12
Nieuwshub voor Gunjack,7
Nieuwshub voor Drive on Moscow,13
Nieuwshub voor The Orchard of Stray Sheep,3
Nieuwshub voor The Wall,15
Nieuwshub voor 无限次元,1
Nieuwshub voor Mesel,5
Nieuwshub voor Raging Justice,13
Nieuwshub voor Stockpile,1
Nieuwshub voor Spirits of Xanadu,27
Nieuwshub voor Impossible Quest,21
Nieuwshub voor Nijikoi no Houkakou,1
Nieuwshub voor Urban Tale,77
Nieuwshub voor Football School,14
Nieuwshub voor Bullet Beat: Musical Shoot'em up,7
Nieuwshub voor New Age,51
Nieuwshub voor Trivia Vault: Health Trivia Deluxe,1
Nieuwshub voor DreamWorks Voltron VR Chronicles,1
Nieuwshub voor Football Club Simulator - FCS #21,38
Nieuwshub voor Revolution Ace,15
Nieuwshub voor US Spy: Mission in Russia,7
Nieuwshub voor Rainbow Snake,1
Nieuwshub voor Uurnog Uurnlimited,17
Nieuwshub voor Nazi,1
Nieuwshub voor Kings Town,8
Nieuwshub voor Midnight Evil,10
Nieuwshub voor Maytroid. I swear it's a nice game too,27
Nieuwshub voor Parker & Lane: Twisted Minds,1
Nieuwshub voor All Hail The Cook-o-tron,12
Nieuwshub voor Smooth Operators,17
Nieuwshub voor Untale: King of Revinia,8
Nieuwshub voor Tiny Tales: Heart of the Forest,30
Nieuwshub voor The Eerie Inn,1
Nieuwshub voor Cursed,15
Nieuwshub voor Royal Heroes,76
Nieuwshub voor IMAZE.EXE,3
Nieuwshub voor Neon Warp,20
Nieuwshub voor The Running Man,14
Nieuwshub voor Foresight,294
Nieuwshub voor Soulless: Ray Of Hope,3
Nieuwshub voor The Storm Guard: Darkness is Coming,33
Nieuwshub voor Gridiron Solitaire,5
Nieuwshub voor Vampires!,1
Nieuwshub voor Bionic Commando: Rearmed,3
Nieuwshub voor Time Gap,9
Nieuwshub voor 21 Days,6
Nieuwshub voor The Developer,1
Nieuwshub voor LOST PLANET® 3,10
Nieuwshub voor Mysteries of Neverville: The Runestone of Light,9
Nieuwshub voor TAL: Arctic 3,1
Nieuwshub voor Spooky Ghosts Dot Com,10
Nieuwshub voor A Wolf in Autumn,17
Nieuwshub voor Filthy Hands,10
Nieuwshub voor Second Hand: Frankie's Revenge,27
Nieuwshub voor Puzzle Pirates: Dark Seas,20
Nieuwshub voor GunZ 2: The Second Duel,112
Nieuwshub voor Aegis Defenders,6
Nieuwshub voor STURMWIND EX,3
Nieuwshub voor Plankton,19
Nieuwshub voor Roll'd,21
Nieuwshub voor Battle Fleet 2,50
"Nieuwshub voor Causa, Voices of the Dusk",53
Nieuwshub voor Abo Khashem,6
Nieuwshub voor The Story Goes On,19
Nieuwshub voor Supply Chain Idle,1
Nieuwshub voor Doll of Resurrection,3
Nieuwshub voor No Way Out - A Dead Realm Tale,5
Nieuwshub voor God of Word,10
Nieuwshub voor Strategic Command Classic: WWI,3
Nieuwshub voor Teke Teke - テケテケ,3
Nieuwshub voor CyberHive,8
Nieuwshub voor Puzzle & Chess,1
Nieuwshub voor Evochron Mercenary,14
Nieuwshub voor Senko no Ronde 2 旋光の輪舞２,26
Nieuwshub voor Winged Sakura: Mindy's Arc 2,3
Nieuwshub voor QuietMansion2,39
Nieuwshub voor Mountain Troll,1
Nieuwshub voor My Coloring Book: Professions,1
Nieuwshub voor Time Carnage VR,13
Nieuwshub voor Chained: A Victorian Nightmare,1
Nieuwshub voor Fighters Legacy,1
Nieuwshub voor IS -Infinite Stratos- Versus Colors,4
Nieuwshub voor Unstoppable Hamster,1
Nieuwshub voor Spectraball,5
Nieuwshub voor MOAI: Build Your Dream,17
Nieuwshub voor ORBITAL,7
Nieuwshub voor Zolg,6
Nieuwshub voor Trainz Trouble,1
Nieuwshub voor Ironclad Tactics,7
Nieuwshub voor Amber's Magic Shop,1
Nieuwshub voor BomberZone,11
Nieuwshub voor TITAN SLAYER Ⅱ,20
Nieuwshub voor Guardians: Royal Journey,6
Nieuwshub voor Case 00: The Cannibal Boy,10
Nieuwshub voor Fragile Box,1
Nieuwshub voor NEONomicon,1
Nieuwshub voor Royal Rescue SRPG,4
Nieuwshub voor Pro Strategy Football 2020,1
Nieuwshub voor Grim Wanderings,3
Nieuwshub voor IronBorn,1
Nieuwshub voor The Initiate,14
Nieuwshub voor VR Fight COVID-19,1
Nieuwshub voor Wars of Napoleon,5
Nieuwshub voor Light Apprentice - The Comic Book RPG,22
Nieuwshub voor Zooicide,11
Nieuwshub voor Vectromirror™,6
Nieuwshub voor SoulHunt,32
Nieuwshub voor Fate Tectonics,20
Nieuwshub voor MOAI 2: Path to Another World,8
Nieuwshub voor Hyper Simon X,1
Nieuwshub voor Cooking Trip: Back on the road,1
Nieuwshub voor ChromaGun,16
Nieuwshub voor XenoShyft,10
Nieuwshub voor LesLove.Club: Jessica and Ashley,7
Nieuwshub voor Elegy for a Dead World,5
Nieuwshub voor Songbringer,104
Nieuwshub voor Nightmare (Incubo),11
Nieuwshub voor Shu's Garden,7
Nieuwshub voor Chantelise - A Tale of Two Sisters,1
Nieuwshub voor Woah Dave!,5
Nieuwshub voor Holodrive,97
Nieuwshub voor The Unicorn Princess,1
Nieuwshub voor Battle Islands: Commanders,51
Nieuwshub voor Unreal 2: The Awakening,1
Nieuwshub voor Square Brawl,1
Nieuwshub voor Midnight Mysteries,3
Nieuwshub voor Bogatyr,15
Nieuwshub voor DESYNC,24
Nieuwshub voor Dragon Call,46
Nieuwshub voor Draw Rider 2,60
Nieuwshub voor Super Slam Dunk Touchdown,39
Nieuwshub voor Margonem,174
Nieuwshub voor Liar Trick -Psychological Crime Mystery-,14
Nieuwshub voor Time Transit VR,5
Nieuwshub voor Gado Fight,1
Nieuwshub voor Game Of Puzzles: Space,1
Nieuwshub voor Share,9
Nieuwshub voor Fortified,21
Nieuwshub voor spaceBOUND,14
Nieuwshub voor Super Slime Arena,21
Nieuwshub voor Fortissimo FA INTL Ver,5
Nieuwshub voor Eternal Dread,6
Nieuwshub voor Stonedeep,78
Nieuwshub voor Kult: Heretic Kingdoms,1
Nieuwshub voor Property,30
Nieuwshub voor Disney•Pixar Cars Toon: Mater's Tall Tales,1
Nieuwshub voor Heroic Armored Company,12
Nieuwshub voor Planet Stronghold: Colonial Defense,7
Nieuwshub voor Sansar,279
Nieuwshub voor Masked Forces: Zombie Survival,11
Nieuwshub voor Romance of the Three Kingdoms Ⅵ with Power Up Kit / 三國志VI with パワーアップキット,3
Nieuwshub voor Imperia Online,67
Nieuwshub voor Monsters sandbox,8
Nieuwshub voor Realms of Arkania: Blade of Destiny,52
Nieuwshub voor EARTH'S DAWN,3
Nieuwshub voor Bighead Runner,5
Nieuwshub voor Surviv.io - 2D Battle Royale,3
Nieuwshub voor My Little Dog Adventure,1
Nieuwshub voor Happy Halloween,1
Nieuwshub voor Dubstep Bird,3
Nieuwshub voor The Spatials: Galactology,92
Nieuwshub voor Silent Service,1
Nieuwshub voor Quantum Conscience,7
Nieuwshub voor History2048 - 3D puzzle number game,1
Nieuwshub voor Prank!,1
Nieuwshub voor Silence of the Sleep,20
Nieuwshub voor Pixel Puzzles 2: RADical ROACH,30
Nieuwshub voor Fossil Hunters,25
Nieuwshub voor MMA Arena,8
Nieuwshub voor Chronicles of Magic: Divided Kingdoms,3
Nieuwshub voor After The End: The Harvest,196
Nieuwshub voor Dimension Hunter VR,14
Nieuwshub voor Cash Rush,7
Nieuwshub voor Don't Give Up: Not Ready to Die,5
Nieuwshub voor Run Rabbit Run,22
Nieuwshub voor GIGANTIC ARMY,12
"Nieuwshub voor GO AWAY, THERE'S KUMIS OVER THERE!",26
Nieuwshub voor Nyanco Dream,3
Nieuwshub voor Dangerous Golf,18
Nieuwshub voor Grass Simulator,15
Nieuwshub voor 烈山海一(BMS1),59
Nieuwshub voor Lexica,1
Nieuwshub voor X-Blades,9
Nieuwshub voor Santa Claws,4
Nieuwshub voor Demise of Nations,107
Nieuwshub voor Nothing!,5
Nieuwshub voor Rhythm Rush!,16
Nieuwshub voor MoonQuest,14
Nieuwshub voor Dragon Sinker,1
Nieuwshub voor 7th Sector,20
Nieuwshub voor Sword Legacy: Omen,21
Nieuwshub voor Protoball,21
Nieuwshub voor CAPSULE,1
Nieuwshub voor Kim,30
Nieuwshub voor Fruit Juice,1
Nieuwshub voor Gun Rocket,1
Nieuwshub voor Ogre Tale,12
Nieuwshub voor LASTFIGHT,7
Nieuwshub voor Turbo Pug 3D,6
Nieuwshub voor Goosebumps Dead of Night,4
Nieuwshub voor 夏花的轨迹——A summer promise to forever,14
Nieuwshub voor Rogue Wizards,56
"Nieuwshub voor Destiny's Princess: A War Story, A Love Story",15
Nieuwshub voor Eternal Magic,42
Nieuwshub voor Waba,1
Nieuwshub voor Kakele Online - MMORPG,1
Nieuwshub voor Supreme Ruler 1936,30
Nieuwshub voor Echo of Combats,33
Nieuwshub voor Infinity Wars: Animated Trading Card Game,135
Nieuwshub voor Dee-6: Dice Defenders,8
Nieuwshub voor Detective Story,1
Nieuwshub voor BadLads,18
Nieuwshub voor Flat Kingdom Paper's Cut Edition,21
Nieuwshub voor AWAKE - Definitive Edition,3
Nieuwshub voor Trafic Road Rush,3
Nieuwshub voor Skytropolis,9
Nieuwshub voor The Killer of Dishonor,1
Nieuwshub voor 记忆重现/Rememory,1
Nieuwshub voor Rover Builder,22
Nieuwshub voor Trivia Vault Baseball Trivia,1
Nieuwshub voor King's Heir: Rise to the Throne,6
Nieuwshub voor Voxel Tanks,7
Nieuwshub voor I Hate Running Backwards,19
Nieuwshub voor Masters of Puzzle,95
Nieuwshub voor Znkl - 177,3
Nieuwshub voor Deep the Game,19
Nieuwshub voor Sea Battle: Through the Ages,19
Nieuwshub voor Ultimate Ski Jumping 2020,1
Nieuwshub voor Heileen 3: New Horizons,3
Nieuwshub voor Trauma,1
Nieuwshub voor Minions Battle,1
Nieuwshub voor Moorhuhn Kart,4
Nieuwshub voor Jack Orlando: Director's Cut,11
Nieuwshub voor DOG GONE GOLFING,5
Nieuwshub voor Chocolat Rush,6
Nieuwshub voor 梅塔特隆 Metatron,28
Nieuwshub voor Durak!,1
Nieuwshub voor Tennis Arcade VR,5
Nieuwshub voor Mighty Monster Mayhem,6
Nieuwshub voor Bake 'n Switch,35
Nieuwshub voor Toren,4
Nieuwshub voor Just Ignore Them,52
Nieuwshub voor Wrack,58
Nieuwshub voor Metal War Online: Retribution,67
Nieuwshub voor Harvest: Massive Encounter,6
Nieuwshub voor Strike.is: The Game,106
Nieuwshub voor Shieldmaiden: Remix Edition,5
Nieuwshub voor Morphine,7
Nieuwshub voor Freebie,15
Nieuwshub voor METAL SLUG DEFENSE,1
Nieuwshub voor Lamp Chronicle,11
Nieuwshub voor War Trigger 3,1
Nieuwshub voor Telepath Tactics,33
Nieuwshub voor King Arthur - The Role-playing Wargame,1
Nieuwshub voor Wild Terra Online,511
Nieuwshub voor Clazer,21
"Nieuwshub voor Orb Labs, Inc.",11
Nieuwshub voor Explosive Jake,1
Nieuwshub voor Rime Berta,24
Nieuwshub voor Corona Borealis,1
Nieuwshub voor Rekindling,85
Nieuwshub voor Candy Kingdom VR,14
Nieuwshub voor OnsenVR,15
Nieuwshub voor Survive The Dark,5
Nieuwshub voor Wow Dance,8
Nieuwshub voor Kwaidan,6
Nieuwshub voor Defense of Egypt: Cleopatra Mission,11
Nieuwshub voor Hack 'n' Slash,12
Nieuwshub voor Fight The Dragon,94
Nieuwshub voor The Stranger VR,8
Nieuwshub voor Adventures of Bertram Fiddle 2: A Bleaker Predicklement,8
Nieuwshub voor My Sunny Resort,7
Nieuwshub voor FOX n FORESTS,11
Nieuwshub voor Gemini: Heroes Reborn,3
Nieuwshub voor Animus - Stand Alone,1
Nieuwshub voor Bloom,6
Nieuwshub voor Moe Mekuri SP - 萌めくりSP -,31
Nieuwshub voor Phobos,14
Nieuwshub voor Projector Face,1
Nieuwshub voor iubes:2,15
Nieuwshub voor Johnny Mystery and The Halloween Killer,1
Nieuwshub voor Utopia,28
Nieuwshub voor Allods Online RU,144
Nieuwshub voor Cargo Breach,6
Nieuwshub voor Fancy Skulls,12
Nieuwshub voor 光之迷城 / Dawn of the Lost Castle,29
Nieuwshub voor A Place for the Unwilling,41
Nieuwshub voor Blind Spot,3
Nieuwshub voor Californium,6
Nieuwshub voor Super Inefficient Golf,5
Nieuwshub voor Pixel Puzzles: UndeadZ,38
Nieuwshub voor Qbio,3
Nieuwshub voor Azure Saga: Pathfinder,19
Nieuwshub voor The Wonderful End of the World,1
Nieuwshub voor 众生,10
Nieuwshub voor Atlas Rogues,14
Nieuwshub voor ASSAULT GUNNERS HD EDITION,1
Nieuwshub voor The Wastes,22
Nieuwshub voor Grayland,1
Nieuwshub voor Saturday Morning RPG,7
Nieuwshub voor Crawlers and Brawlers,25
Nieuwshub voor Words for Evil,6
Nieuwshub voor Battle for the Galaxy,21
Nieuwshub voor Final Dusk,15
Nieuwshub voor Gelu,3
Nieuwshub voor StarsOne,96
Nieuwshub voor Drift Into Eternity,89
Nieuwshub voor Gods Will Fall,4
Nieuwshub voor CALL OF LDPR,3
Nieuwshub voor Bullshot,21
Nieuwshub voor Reprisal Universe,7
Nieuwshub voor A Writer And His Daughter,14
Nieuwshub voor LASHEK,3
Nieuwshub voor Screamer 2,1
Nieuwshub voor Infinite Tournament Paintball,12
Nieuwshub voor Rise & Shine,8
Nieuwshub voor Eon Fleet,3
