title,update_count2
Nieuwshub voor Danger Gazers,16
Nieuwshub voor Demon's Crystals,13
Nieuwshub voor Single Diary: Fresh Graduate,7
Nieuwshub voor 8BitBoy™,21
Nieuwshub voor Ion Assault,5
Nieuwshub voor 222 Hearts,3
Nieuwshub voor Sparkle Unleashed,5
Nieuwshub voor Art of Boxing,29
Nieuwshub voor Burning Knight,25
Nieuwshub voor Luckslinger,14
Nieuwshub voor 甜点恋人 / Pastry Lovers,22
Nieuwshub voor Never Date Werewolves,1
Nieuwshub voor VR Monster Awakens,19
Nieuwshub voor My Name is Addiction,5
Nieuwshub voor Project Genesis,41
Nieuwshub voor Zombie Riot,1
Nieuwshub voor Creature Romances: Kokonoe Kokoro,3
Nieuwshub voor Call Of Unity,1
Nieuwshub voor ZIC – Zombies in City,9
Nieuwshub voor Romance of the Three Kingdoms Ⅲ / 三國志Ⅲ,1
Nieuwshub voor Gekisou! Benza Race -Toilet Shooting Star-,1
Nieuwshub voor East Tower - Akio (East Tower Series Vol. 1),17
Nieuwshub voor 最后的夜晚 Babel,1
Nieuwshub voor Fair Strike,7
Nieuwshub voor Not Dying Today,14
Nieuwshub voor GamersGoMakers,12
Nieuwshub voor Adventure of Bears,1
Nieuwshub voor Warp Drive,1
Nieuwshub voor Hold Your Own,118
Nieuwshub voor Townopolis,5
Nieuwshub voor VOID,7
Nieuwshub voor Andor - Wrecking Dawn,83
Nieuwshub voor Scooby Doo! & Looney Tunes Cartoon Universe: Adventure,1
Nieuwshub voor Blast Zone! Tournament,57
Nieuwshub voor Watching Delusion,5
Nieuwshub voor WAY HOME,3
Nieuwshub voor Hope For Village,9
Nieuwshub voor Climb,12
Nieuwshub voor Old Gods Rising,5
Nieuwshub voor To Battle!: Hell's Crusade,4
Nieuwshub voor There Came an Echo,12
Nieuwshub voor Weakless,20
Nieuwshub voor Brain off,1
Nieuwshub voor Cold Iron - Quick Draw Western Duels,7
Nieuwshub voor Sabotaj,17
Nieuwshub voor EEP 13,1
Nieuwshub voor Elliot Quest,16
Nieuwshub voor Savage Vessels,36
Nieuwshub voor Instinct,5
Nieuwshub voor 武侠乂 The Swordsmen X,103
Nieuwshub voor The 7th Circle - Endless Nightmare,17
Nieuwshub voor A Game of Humans,9
Nieuwshub voor Last Tide,8
Nieuwshub voor Saint Kotar: The Yellow Mask,52
Nieuwshub voor Norega,34
Nieuwshub voor XXZ: XXL,48
Nieuwshub voor Zombie Party,44
Nieuwshub voor Conclave,11
Nieuwshub voor MiNNaDe Counter Fight,17
Nieuwshub voor Cubemen 2,14
Nieuwshub voor RAIN Project - a touhou fangame,17
Nieuwshub voor Lovely Planet Arcade,3
Nieuwshub voor Goat over it,1
Nieuwshub voor 阿比斯的宝藏 - Treasure of abyss,14
Nieuwshub voor Timber Tennis: Versus,3
Nieuwshub voor Puzzle Tactics,1
Nieuwshub voor Somewhere inside,1
Nieuwshub voor TableTop Soccer,51
Nieuwshub voor Radiant One,1
Nieuwshub voor Crowman & Wolfboy,9
Nieuwshub voor 告死天使的审判-Death Angel Trial,5
Nieuwshub voor Skyland 1976,13
Nieuwshub voor A Long Way Home,13
Nieuwshub voor Corrosion: Cold Winter Waiting [Enhanced Edition],12
Nieuwshub voor Mumps,5
Nieuwshub voor Beyond Sol,36
Nieuwshub voor Civil War: 1861,9
Nieuwshub voor Dungeon Lord,1
Nieuwshub voor BQM - BlockQuest Maker-,9
Nieuwshub voor InMind 2 VR,8
Nieuwshub voor Crazy Plant Shop,1
Nieuwshub voor Finding the Soul Orb,1
Nieuwshub voor Ultimate Spinner Simulator - Unstress Yourself,1
Nieuwshub voor Physical Exorcism: Case 01,6
Nieuwshub voor Primordian,42
Nieuwshub voor 探险与魔法,11
Nieuwshub voor STEEL STRIDER,7
Nieuwshub voor Monochroma,9
Nieuwshub voor Total Extreme Wrestling 2010,1
Nieuwshub voor The Oil Blue: Steam Legacy Edition,3
Nieuwshub voor Katharsis,3
Nieuwshub voor Antihorror,1
Nieuwshub voor 103,10
Nieuwshub voor The Dwarf Run,11
Nieuwshub voor Gran Skrea Online,68
Nieuwshub voor Dyad,3
Nieuwshub voor AIRHEART - Tales of broken Wings,41
Nieuwshub voor Get Off My Lawn!,3
Nieuwshub voor Black Paradox,29
Nieuwshub voor Just Ride：Apparent Horizon 狂飙：极限视界,86
Nieuwshub voor ANKI,10
Nieuwshub voor Girls' civilization 2,17
Nieuwshub voor The Sandbox,36
Nieuwshub voor 1010,1
Nieuwshub voor Schein,3
Nieuwshub voor Hot Tin Roof: The Cat That Wore A Fedora,11
Nieuwshub voor 东方剑姬在西方旅行的故事,1
Nieuwshub voor Theatre of War 3: Korea,3
Nieuwshub voor Weird Worlds: Return to Infinite Space,5
Nieuwshub voor Ubersoldier II,1
Nieuwshub voor Epitasis,26
Nieuwshub voor Viking Brothers,1
Nieuwshub voor Swords and Sorcery - Underworld - Definitive Edition,14
Nieuwshub voor BEACHED,14
Nieuwshub voor Party Tycoon,31
Nieuwshub voor Dungelot: Shattered Lands,11
Nieuwshub voor Clan N,53
"Nieuwshub voor Resette's Prescription ~Book of memory, Swaying scale~",8
Nieuwshub voor Queen's Quest 4: Sacred Truce,8
Nieuwshub voor Boxes Inc.,10
Nieuwshub voor A Day Without Me,3
Nieuwshub voor Over The Void,7
Nieuwshub voor Polyball,105
Nieuwshub voor White Night,1
Nieuwshub voor Sorcery Saga: Curse of the Great Curry God,3
Nieuwshub voor Terra Lander Remastered,5
Nieuwshub voor Color by Number - Pixel Draw,1
Nieuwshub voor Access Denied,1
Nieuwshub voor 卡片地下城Card Monsters: Dungeon,14
Nieuwshub voor Ray's The Dead,49
Nieuwshub voor Easter Clicker: Idle Manager,1
Nieuwshub voor The Samaritan Paradox,9
Nieuwshub voor Codex of Victory,27
Nieuwshub voor Shades Of Heroes,18
Nieuwshub voor Killer Inside Us,8
Nieuwshub voor Avalon Legends Solitaire 3,1
Nieuwshub voor Riot of the numbers,1
Nieuwshub voor The Sorrowvirus,16
Nieuwshub voor Twilight Town,5
Nieuwshub voor Faron's Fate,13
Nieuwshub voor Warring States,57
Nieuwshub voor Tower of Fate,9
Nieuwshub voor Four Sided Fantasy,4
Nieuwshub voor Boid,22
Nieuwshub voor Strangers of the Power,35
Nieuwshub voor Elemental Combat,12
Nieuwshub voor CTHON,20
Nieuwshub voor Magic Scroll Tactics / マジックスクロールタクティクス / 魔法卷轴 / 魔法捲軸,35
Nieuwshub voor Princess Battles,4
Nieuwshub voor Enemy On Board,43
Nieuwshub voor 三国英雄列传 (Legendary Heros in the Three Kingdoms),13
Nieuwshub voor Lazaretto,9
Nieuwshub voor The Fastest Fist,8
Nieuwshub voor Revulsion,189
Nieuwshub voor They Can't Stop All Of Us,58
Nieuwshub voor BLOCKADE War Stories,5
Nieuwshub voor The Island: Into The Mist,20
Nieuwshub voor Never give up!,5
Nieuwshub voor Space Cows,24
Nieuwshub voor Nazi Bunker,1
Nieuwshub voor McDROID,59
Nieuwshub voor Monsti,1
Nieuwshub voor RymdResa,82
Nieuwshub voor Red Algorithm,15
Nieuwshub voor Aefen Fall,5
Nieuwshub voor MineSweep,1
Nieuwshub voor Immortal Empire,26
Nieuwshub voor Myths Of Orion: Light From The North,15
Nieuwshub voor Depths Of Horror: Mushroom Day,1
Nieuwshub voor Die for Valhalla!,11
Nieuwshub voor The Farm,5
Nieuwshub voor Genesia Legacy: Ultimate Domain,15
Nieuwshub voor Survival Classic,20
Nieuwshub voor Links E6,3
Nieuwshub voor Diabolical,1
Nieuwshub voor Spacer: Legacies,59
Nieuwshub voor Throbax TD,85
Nieuwshub voor 惊奇剑士,1
Nieuwshub voor Lilly Looking Through,1
Nieuwshub voor The Polynomial - Space of the music,5
Nieuwshub voor The Huntsman: Winter's Curse,17
Nieuwshub voor Heroes of Loot,20
Nieuwshub voor Gnomancer,35
Nieuwshub voor ClusterPuck 99,12
Nieuwshub voor A.D. 2047,1
Nieuwshub voor Incredipede,1
Nieuwshub voor Freud Gate,5
Nieuwshub voor Nomads of the Fallen Star,27
Nieuwshub voor The Novelist,28
Nieuwshub voor Trivia Vault Basketball Trivia,1
Nieuwshub voor Pressure Overdrive,8
Nieuwshub voor 8 Ball,4
Nieuwshub voor Dungeon League,31
Nieuwshub voor Super VR Trainer,17
Nieuwshub voor Space Stories: Darth Star,3
Nieuwshub voor Civil War: 1862,19
Nieuwshub voor McRogue,31
Nieuwshub voor The far Kingdoms: Winter Solitaire,8
Nieuwshub voor Mahasona,5
Nieuwshub voor Dieselpunk Wars,59
Nieuwshub voor Lander 8009 VR,7
Nieuwshub voor Loki,1
Nieuwshub voor Shadowgate: MacVenture Series,5
Nieuwshub voor Inventioneers,1
Nieuwshub voor The Legend of Dark Witch,29
Nieuwshub voor 30 days to survive,54
Nieuwshub voor Shadow Puppeteer,18
Nieuwshub voor How to shoot a criminal,3
Nieuwshub voor DROD RPG: Tendry's Tale,13
Nieuwshub voor Hexa Trains,9
Nieuwshub voor Pankapu,31
Nieuwshub voor Secret Ponchos,83
Nieuwshub voor Lethis - Path of Progress,35
Nieuwshub voor The Voice from Heaven,7
Nieuwshub voor Freeze Climbing,1
Nieuwshub voor Beat Boxer,7
Nieuwshub voor Kanji Training Game,3
Nieuwshub voor Zombie Road Rider,10
Nieuwshub voor HEXION,16
Nieuwshub voor Last Half of Darkness - Society of the Serpent Moon,1
Nieuwshub voor ExoTanks,66
Nieuwshub voor You Don't Have Time,7
Nieuwshub voor I fell from Grace,16
Nieuwshub voor Drunken Fight Simulator,1
Nieuwshub voor Mad Pack,16
Nieuwshub voor Dungeon Crowley,82
Nieuwshub voor Thief Town,15
Nieuwshub voor 地城蔷薇,5
Nieuwshub voor ABRACA - Imagic Games,1
Nieuwshub voor 百花三国志(Banner of the THREE KINGDOMS),6
Nieuwshub voor RogueJack: Roguelike Blackjack,10
Nieuwshub voor Eselmir and the five magical gifts,14
Nieuwshub voor After the Empire,10
Nieuwshub voor Paranoia: Deliver Me,1
Nieuwshub voor CastleMiner Warfare,1
Nieuwshub voor God Mode,4
Nieuwshub voor Aerial Destruction,9
Nieuwshub voor Mekazoo,14
Nieuwshub voor Alum,6
Nieuwshub voor Zombie Ballz,8
Nieuwshub voor Kiai Resonance,6
Nieuwshub voor Rise of Prussia Gold,3
Nieuwshub voor Musclecar Online,7
Nieuwshub voor Fantasy Heroes,1
Nieuwshub voor 鬼王~Oni,3
Nieuwshub voor Tomato Way 2,12
Nieuwshub voor Paranormal State: Poison Spring,1
Nieuwshub voor cat notebook,11
Nieuwshub voor The Wild Eternal,9
Nieuwshub voor Rugby Challenge 3,1
Nieuwshub voor Eliosi's Hunt,18
Nieuwshub voor Desire,20
Nieuwshub voor Austen Translation,21
Nieuwshub voor Into The Haze,6
Nieuwshub voor Major\Minor,69
Nieuwshub voor Virtual Families 2: Our Dream House,1
Nieuwshub voor iBomber Defense,1
"Nieuwshub voor Remember, Remember",1
Nieuwshub voor Banzai Escape 2,6
Nieuwshub voor Inferna,152
Nieuwshub voor Mad Crown,42
Nieuwshub voor Garden Of Mooj,70
Nieuwshub voor Kongfusion,1
Nieuwshub voor Goblin Times,3
Nieuwshub voor Time Leap Paradise SUPER LIVE!,10
Nieuwshub voor Lightseekers,18
Nieuwshub voor Niko: Through The Dream,15
Nieuwshub voor Dangerous High School Girls in Trouble!™,5
Nieuwshub voor Nightwalker,5
Nieuwshub voor Split or Steal,22
Nieuwshub voor The Away Team: Lost Exodus,39
Nieuwshub voor Escape Bloody Mary,6
Nieuwshub voor Toilet Run,9
Nieuwshub voor Dyscourse,9
Nieuwshub voor FEIST,14
Nieuwshub voor The Guise,16
Nieuwshub voor The Moon Sliver,28
Nieuwshub voor Rogue Shooter: The FPS Roguelike,7
Nieuwshub voor ArcticBoy: The Interactive Story,6
Nieuwshub voor Theseus,1
Nieuwshub voor Tank Battle: 1944,39
Nieuwshub voor Rack N Ruin,7
Nieuwshub voor Where's My Mommy?,9
Nieuwshub voor ANDROMALIUS,3
Nieuwshub voor Nothing,1
Nieuwshub voor Dream Detective,1
Nieuwshub voor 有翼のフロイライン Wing of Darkness,1
Nieuwshub voor Rise of the Slime,28
Nieuwshub voor VROOM: Aerie,15
Nieuwshub voor The Mystery Of Woolley Mountain,37
Nieuwshub voor Scraps: Modular Vehicle Combat,106
Nieuwshub voor Freebot : Battle for FreeWeb,15
Nieuwshub voor Starr Mazer: DSP,26
Nieuwshub voor One day 一天,1
Nieuwshub voor NEXT JUMP: Shmup Tactics,29
Nieuwshub voor Food Truck VR,34
Nieuwshub voor Rain Blood Chronicles: Mirage,1
Nieuwshub voor INTERPOINT,18
Nieuwshub voor The Hurricane of the Varstray -Collateral hazard-,38
Nieuwshub voor Mahjong Magic Islands,1
Nieuwshub voor Battle for Iwo Jima,3
Nieuwshub voor Willy-Nilly Knight,26
Nieuwshub voor Sentry Knight Tactics,9
Nieuwshub voor Poco In Dungeon,3
Nieuwshub voor AENTITY,1
Nieuwshub voor Beer!,3
Nieuwshub voor Geeksos,12
Nieuwshub voor Mahjong Deluxe 3,7
